{
  "_sample_comment": "这是一个 sample，文件实质完成后删掉这行注释",
  "runbook_id": "style-preserving-rewrite",
  "runbook_version": "1.0.0",
  "required_stages": ["intake", "source-text-analysis", "planning", "drafting", "semantic-review", "style-review", "editor-review"],
  "optional_stages": ["publication-preparation"],
  "required_artifacts": ["writing-brief.md", "authorized-source-text.md", "article-plan.md", "draft-01.md", "semantic-review-result.md", "style-review-result.json", "editor-review.md"],
  "artifact_templates": {
    "writing-brief.md": "shared-writing-harness/artifact-templates/writing-brief-template.md",
    "authorized-source-text.md": "shared-writing-harness/artifact-templates/authorized-source-text-template.md",
    "article-plan.md": "shared-writing-harness/artifact-templates/article-plan-template.md",
    "draft-01.md": "shared-writing-harness/artifact-templates/article-draft-template.md",
    "semantic-review-result.md": "shared-writing-harness/artifact-templates/semantic-review-result-template.md",
    "style-review-result.json": "shared-writing-harness/artifact-templates/style-review-result-template.json",
    "editor-review.md": "shared-writing-harness/artifact-templates/editor-review-template.md"
  },
  "required_policy_rule_ids": ["POLICY-FACTUALITY-001", "POLICY-DERIVATION-001", "POLICY-ORIGINALITY-001", "POLICY-PUBLICATION-001"]
}
