{
  "_sample_comment": "这是一个 sample，文件实质完成后删掉这行注释",
  "runbook_id": "standard-researched-essay",
  "runbook_version": "1.0.0",
  "required_stages": ["intake", "research", "planning", "drafting", "factual-review", "style-review", "editor-review", "publication-preparation"],
  "optional_stages": ["editorial-revision"],
  "required_artifacts": ["writing-brief.md", "research-pack.md", "article-plan.md", "draft-01.md", "factual-review-result.json", "style-review-result.json", "editor-review.md", "final-approved-article.md"],
  "artifact_templates": {
    "writing-brief.md": "shared-writing-harness/artifact-templates/writing-brief-template.md",
    "research-pack.md": "shared-writing-harness/artifact-templates/research-pack-template.md",
    "article-plan.md": "shared-writing-harness/artifact-templates/article-plan-template.md",
    "draft-01.md": "shared-writing-harness/artifact-templates/article-draft-template.md",
    "factual-review-result.json": "shared-writing-harness/artifact-templates/factual-review-result-template.json",
    "style-review-result.json": "shared-writing-harness/artifact-templates/style-review-result-template.json",
    "editor-review.md": "shared-writing-harness/artifact-templates/editor-review-template.md",
    "final-approved-article.md": "shared-writing-harness/artifact-templates/final-approved-article-template.md"
  },
  "required_policy_rule_ids": ["POLICY-FACTUALITY-001", "POLICY-DERIVATION-001", "POLICY-ORIGINALITY-001", "POLICY-PUBLICATION-001"]
}
